{
  "run_id": "fixture-001",
  "loop": "capture",
  "result": "no-op",
  "status": "ok",
  "error_count": 0,
  "selected_input": null,
  "touched_paths": [],
  "evidence": ["The inbox contained no eligible files"],
  "next_action": "Wait for the next public-safe handoff",
  "next_action_type": "wait"
}
